{
  "schemaVersion": 2,
  "moduleId": "surgery-anesthesia-msk-nsaid-hold",
  "version": 1,
  "owner": "Test fixture",
  "reviewBy": "2027-04-10",
  "appliesWhen": {
    "appointmentTime": {
      "fromInclusive": "00:00",
      "toExclusive": "24:00"
    }
  },
  "steps": [
    {
      "id": "nsaids",
      "type": "medication_hold",
      "anchor": "appointment",
      "timing": {
        "kind": "day",
        "day": -2
      },
      "remind": {
        "kind": "dayAt",
        "day": -2,
        "time": "07:00",
        "defaulted": true
      },
      "allowNight": false,
      "pastDue": "doNow",
      "text": "Stop taking anti-inflammatory pain pills like ibuprofen (Advil, Motrin) and naproxen (Aleve)."
    }
  ],
  "source": "https://www.mskcc.org/cancer-care/patient-education/instructions-before-your-procedure-or-surgery",
  "accessed": "2026-10-10",
  "note": "Test data only. Not clinical guidance."
}
