{
  "schemaVersion": 2,
  "moduleId": "cardiac-cath-uw-groin-site",
  "version": 1,
  "owner": "Test fixture",
  "reviewBy": "2027-04-10",
  "appliesWhen": {
    "appointmentTime": {
      "fromInclusive": "00:00",
      "toExclusive": "24:00"
    }
  },
  "steps": [
    {
      "id": "first-day",
      "type": "restriction",
      "anchor": "discharge",
      "timing": {
        "kind": "offset",
        "offset": "PT24H"
      },
      "remind": {
        "kind": "offset",
        "offset": "PT24H",
        "defaulted": false
      },
      "allowNight": false,
      "pastDue": "ignore",
      "text": "You can now do light activity, drive and shower. Still avoid anything that strains the puncture site, like housework or gardening, and limit stairs."
    },
    {
      "id": "first-week",
      "type": "restriction",
      "anchor": "discharge",
      "timing": {
        "kind": "window",
        "start": "PT0H",
        "duration": "PT168H"
      },
      "remind": {
        "kind": "offset",
        "offset": "PT0H",
        "defaulted": false
      },
      "allowNight": false,
      "pastDue": "doNow",
      "text": "Don't lift more than 10 pounds, don't strain on the toilet, and don't let water cover the puncture site (no bath, hot tub or swimming). Showers are OK after the first 24 hours."
    }
  ],
  "source": "https://healthonline.washington.edu/sites/default/files/record_pdfs/How-to-Prepare-for-Your-Heart-Catheterization_a11y.pdf",
  "accessed": "2026-10-10",
  "note": "Test data only. Not clinical guidance.",
  "unmapped": [
    {
      "text": "For 7 days after your procedure.",
      "reason": "The sheet counts from the procedure, which isn't an anchor. Re-anchored to discharge. At least as restrictive: the window ends a few hours later than the sheet says, and between the procedure and discharge the patient is in hospital care."
    }
  ]
}
