{
  "schemaVersion": 2,
  "moduleId": "colo-sutab-low-volume-ccf-iron-hold",
  "version": 1,
  "owner": "Test fixture",
  "reviewBy": "2027-04-10",
  "appliesWhen": {
    "appointmentTime": {
      "fromInclusive": "00:00",
      "toExclusive": "24:00"
    }
  },
  "steps": [
    {
      "id": "iron",
      "type": "medication_hold",
      "anchor": "appointment",
      "timing": {
        "kind": "day",
        "day": -7,
        "lasts": "untilAnchor"
      },
      "remind": {
        "kind": "dayAt",
        "day": -7,
        "time": "07:00",
        "defaulted": true
      },
      "allowNight": false,
      "pastDue": "doNow",
      "text": "Stop taking iron pills."
    }
  ],
  "source": "https://my.clevelandclinic.org/health/articles/sutab-bowel-preparation-instructions",
  "accessed": "2026-10-10",
  "note": "Test data only. Not clinical guidance."
}
