{
  "schemaVersion": 2,
  "moduleId": "colo-golytely-split-bmc-glp1-daily-hold",
  "version": 1,
  "owner": "Test fixture",
  "reviewBy": "2027-04-10",
  "appliesWhen": {
    "appointmentTime": {
      "fromInclusive": "00:00",
      "toExclusive": "24:00"
    }
  },
  "steps": [
    {
      "id": "glp1-daily",
      "type": "medication_hold",
      "anchor": "appointment",
      "timing": {
        "kind": "day",
        "day": 0,
        "lasts": "oneDay"
      },
      "remind": {
        "kind": "dayAt",
        "day": -1,
        "time": "20:00",
        "defaulted": true
      },
      "allowNight": false,
      "pastDue": "critical",
      "text": "Don't take your daily GLP-1 medicine (the name ends in -tide) today."
    }
  ],
  "source": "https://www.bmc.org/files/gastro-prep/english/MEDICATION%20MANAGEMENT%20INSTRUCTIONS%20FOR%20ENDOSCOPY%20-%20update%203.4.25.pdf",
  "accessed": "2026-10-10",
  "note": "Test data only. Not clinical guidance."
}
